{
  "format": "manufact-seo-html-snapshot-v1",
  "siteId": "site-neighborhood-guide",
  "pages": [
    {
      "id": "page-guide",
      "path": "/",
      "html": "<!doctype html><html lang=\"ru\"><head><title>Городской справочник занятий</title><meta name=\"description\" content=\"Категории городских занятий\"><link rel=\"canonical\" href=\"/\"><script type=\"application/ld+json\">{\"@context\":\"https://schema.org\",\"@type\":\"Organization\",\"name\":\"Unverified Publisher\"}</script></head><body><main><h1>Выберите занятие</h1><p>Найдите категорию.</p><a href=\"/help/\">Инструкция по справочнику</a><img src=\"/pic.jpg\" alt=\"\"><div id=\"duplicate\"></div><div id=\"duplicate\"></div><a href=\"/help/#unknown-fragment\">Как пользоваться</a><form><input id=\"email-field\" name=\"email\" type=\"email\"></form></main></body></html>"
    },
    {
      "id": "page-help",
      "path": "/help/",
      "html": "<!doctype html><html lang=\"ru\"><head><title>Как пользоваться справочником</title><meta name=\"description\" content=\"Помощь в навигации\"></head><body><main><h1>Как пользоваться</h1><p>Выбирайте раздел.</p><a href=\"/\">К категориям занятий</a></main></body></html>"
    }
  ],
  "sitemapPaths": [
    "/",
    "/help/"
  ],
  "robotsTxt": "User-agent: *\nAllow: /\n"
}
